<?xml version="1.0" encoding="utf-8" ?>
<schema xmlns:xsi="http://www.w3.org/2001/XMLSchema-instance"
        xsi:noNamespaceSchemaLocation="schema.xsd">
	<column name="StartDateTime" type="dt" />
	<column name="EndDateTime" type="dt" />
	<column name="Identifier" type="g" />
	<column name="Field1" type="s" />
	<column name="Field2" type="i" />
	<column name="Field3" type="b" />
	<column name="Field4" type="d" />
	<column name="Field5" type="dec" />
	<column name="Field6" type="f" />
	<column name="Field7" type="c" />
	<column name="Field8" type="l" />
</schema>